{
  "capability": "brain.classify",
  "version": 1,
  "kind": "ai",
  "effects": "none",
  "summary": "brain.classify v1",
  "input": {
    "type": "object",
    "properties": {
      "order_id": {
        "type": "string"
      }
    },
    "required": [
      "order_id"
    ],
    "additionalProperties": false
  },
  "outcomes": {
    "labelled": {
      "description": "Label suggested",
      "output": {
        "type": "object",
        "properties": {
          "label": {
            "type": "string"
          },
          "confidence": {
            "type": "number",
            "minimum": 0,
            "maximum": 1
          }
        },
        "required": [
          "label"
        ],
        "additionalProperties": false
      }
    }
  },
  "ledger": [
    "input.order_id",
    "output.label"
  ]
}
