{
  "capability": "brain.learn_status",
  "version": 1,
  "kind": "action",
  "effects": "none",
  "summary": "brain.learn_status v1",
  "input": {
    "type": "object",
    "properties": {
      "order_id": {
        "type": "string"
      }
    },
    "required": [
      "order_id"
    ],
    "additionalProperties": false
  },
  "outcomes": {
    "learned": {
      "description": "Learned",
      "output": {
        "type": "object",
        "properties": {
          "confidence": {
            "type": "number",
            "minimum": 0,
            "maximum": 1
          }
        },
        "required": [
          "confidence"
        ],
        "additionalProperties": false
      }
    },
    "not_found": {
      "description": "No attempt",
      "output": {
        "type": "object",
        "properties": {},
        "required": [],
        "additionalProperties": false
      }
    }
  }
}
